{
  "title": "Farské oznamy - 21. týždeň 2026",
  "weekNumber": 21,
  "year": 2026,
  "weekStart": "2026-05-18",
  "weekEnd": "2026-05-24",
  "general": "Tento týždeň upratuje skupina č.3",
  "masses": [
    {
      "day": "Pondelok",
      "date": "2026-05-18",
      "time": "17:00",
      "intention": "Za + manžela Dušana",
      "place": "",
      "note": ""
    },
    {
      "day": "Utorok",
      "date": "2026-05-19",
      "time": "9:00",
      "intention": "Za uzdravenie syna a zdravie celej rodiny",
      "place": "",
      "note": ""
    },
    {
      "day": "Streda",
      "date": "2026-05-20",
      "time": "17:00",
      "intention": "Na úmysel",
      "place": "",
      "note": ""
    },
    {
      "day": "Štvrtok",
      "date": "2026-05-21",
      "time": "17:00",
      "intention": "Na úmysel",
      "place": "",
      "note": ""
    },
    {
      "day": "Piatok",
      "date": "2026-05-22",
      "time": "17:00",
      "intention": "Na úmysel",
      "place": "",
      "note": ""
    },
    {
      "day": "Sobota",
      "date": "2026-05-23",
      "time": "11:00",
      "intention": "Na úmysel",
      "place": "",
      "note": ""
    },
    {
      "day": "Nedeľa",
      "date": "2026-05-24",
      "time": "9:00",
      "intention": "Za veriacich",
      "place": "",
      "note": "Zoslanie Ducha svätého (Turíce)"
    }
  ]
}
