{
  "title": "12. nedeľa cez rok",
  "weekNumber": 26,
  "year": 2026,
  "weekStart": "2026-06-22",
  "weekEnd": "2026-06-28",
  "general": "Tento týždeň upratuje skupina číslo 8",
  "masses": [
    {
      "day": "Pondelok",
      "date": "2026-06-22",
      "time": "17:00",
      "intention": "Za + syna Rastislava",
      "place": "",
      "note": ""
    },
    {
      "day": "Utorok",
      "date": "2026-06-23",
      "time": "09:00",
      "intention": "Za zdravie pani Bartovej",
      "place": "",
      "note": ""
    },
    {
      "day": "Streda",
      "date": "2026-06-24",
      "time": "17:00",
      "intention": "Za + Jána a Annu",
      "place": "",
      "note": "Narodenie sv.Jána Krstiteľa"
    },
    {
      "day": "Štvrtok",
      "date": "2026-06-25",
      "time": "17:00",
      "intention": "Za + z rodiny Škarbovej",
      "place": "",
      "note": ""
    },
    {
      "day": "Piatok",
      "date": "2026-06-26",
      "time": "17:00",
      "intention": " Za živú rodinu Arpálovú",
      "place": "",
      "note": ""
    },
    {
      "day": "Sobota",
      "date": "2026-06-27",
      "time": "08:00",
      "intention": "Za vnučku Ninku",
      "place": "",
      "note": "Ladislava, spomienka"
    },
    {
      "day": "Nedeľa",
      "date": "2026-06-28",
      "time": "09:00",
      "intention": "Za veriacich",
      "place": "",
      "note": "13. nedeľa cez rok"
    }
  ]
}
