{
  "title": "Najsvätejšia trojica",
  "weekNumber": 23,
  "year": 2026,
  "weekStart": "2026-06-01",
  "weekEnd": "2026-06-07",
  "general": "Tento týždeň upratuje skupina číslo 5",
  "masses": [
    {
      "day": "Pondelok",
      "date": "2026-06-01",
      "time": "17:00",
      "intention": "Za + Emila",
      "place": "",
      "note": "Sv. Justín, mučeník"
    },
    {
      "day": "Utorok",
      "date": "2026-06-02",
      "time": "09:00",
      "intention": "Za Božie požehnanie pre rodičov a bratov",
      "place": "",
      "note": ""
    },
    {
      "day": "Streda",
      "date": "2026-06-03",
      "time": "17:00",
      "intention": "Na úmysel",
      "place": "",
      "note": "Sv. Karol Lwanga a spoločníci, mučeníci"
    },
    {
      "day": "Štvrtok",
      "date": "2026-06-04",
      "time": "17:00",
      "intention": "Za veriacich",
      "place": "",
      "note": "Najsvätejšie Kristovo Telo a Krv (Božie telo), prikázaný sviatok"
    },
    {
      "day": "Piatok",
      "date": "2026-06-05",
      "time": "17:00",
      "intention": "Na úmysel",
      "place": "",
      "note": "Bonifác, biskup a mučeník"
    },
    {
      "day": "Sobota",
      "date": "2026-06-06",
      "time": "08:00",
      "intention": "Za veriacich",
      "place": "",
      "note": ""
    },
    {
      "day": "Nedeľa",
      "date": "2026-06-07",
      "time": "09:00",
      "intention": "Za + manžela Františka a celú + rodinu",
      "place": "",
      "note": "10. nedeľa cez rok"
    }
  ]
}
