{
  "title": "29. nedeľa cez rok ",
  "weekNumber": 43,
  "year": 2026,
  "weekStart": "2026-10-19",
  "weekEnd": "2026-10-25",
  "general": "Konkurz na kostolníčku - Alenka Slobodníkova odstupuje zo zdravotných príčin.\n\nZmena času zo soboty na nedeľu o 1.hodinu dozadu.\n\nTento týždeň upratuje skupina číslo 5",
  "masses": [
    {
      "day": "Pondelok",
      "date": "2026-10-19",
      "time": "00:00",
      "intention": "OMŠA NEBUDE ",
      "place": "",
      "note": ""
    },
    {
      "day": "Utorok",
      "date": "2026-10-20",
      "time": "09:00",
      "intention": " Za + starých rodičov a tetu Annu",
      "place": "",
      "note": ""
    },
    {
      "day": "Streda",
      "date": "2026-10-21",
      "time": "17:00",
      "intention": " Za pokoj v rodine",
      "place": "",
      "note": ""
    },
    {
      "day": "Štvrtok",
      "date": "2026-10-22",
      "time": "17:00",
      "intention": " Za + rodičov Annu a Júliusa",
      "place": "",
      "note": "sv.Jána Pavla II. Pápeža ľubovoľná spomienka"
    },
    {
      "day": "Piatok",
      "date": "2026-10-23",
      "time": "17:00",
      "intention": "Za zdravie a Božie požehnanie pre deti vnúčence a pravnúčence",
      "place": "",
      "note": ""
    },
    {
      "day": "Sobota",
      "date": "2026-10-24",
      "time": "08:00",
      "intention": " Za veriacich",
      "place": "",
      "note": ""
    },
    {
      "day": "Nedeľa",
      "date": "2026-10-25",
      "time": "09:00",
      "intention": "Za Božiu pomoc pri operácii Evy",
      "place": "",
      "note": ""
    }
  ]
}
