{
  "title": "18. nedeľa cez rok",
  "weekNumber": 32,
  "year": 2026,
  "weekStart": "2026-08-05",
  "weekEnd": "2026-08-09",
  "general": "Tento týždeň upratuje skupina číslo ",
  "masses": [
    {
      "day": "Streda",
      "date": "2026-08-05",
      "time": "17:00",
      "intention": "Za + mamu Škarbovú",
      "place": "",
      "note": ""
    },
    {
      "day": "Štvrtok",
      "date": "2026-08-06",
      "time": "17:00",
      "intention": " Za 1.prijimajúce deti našej farnosti",
      "place": "",
      "note": "Premenenie Pána, sviatok"
    },
    {
      "day": "Piatok",
      "date": "2026-08-07",
      "time": "17:00",
      "intention": " Za + Štefana Žilku",
      "place": "",
      "note": "1.piatok sv. spoveď a adorácia od 16:30"
    },
    {
      "day": "Sobota",
      "date": "2026-08-08",
      "time": "08:00",
      "intention": " Za + Ivana a manželku",
      "place": "",
      "note": "sv. Dominika kňaza"
    },
    {
      "day": "Nedeľa",
      "date": "2026-08-09",
      "time": "09:00",
      "intention": " Za veriacich",
      "place": "",
      "note": "19. nedeľa cez rok"
    }
  ]
}
