{
  "title": "23. nedeľa cez rok ",
  "weekNumber": 37,
  "year": 2026,
  "weekStart": "2026-09-07",
  "weekEnd": "2026-09-13",
  "general": "Tento týždeň upratuje skupina číslo 9",
  "masses": [
    {
      "day": "Pondelok",
      "date": "2026-09-07",
      "time": "17:00",
      "intention": "Omša nebude",
      "place": "",
      "note": ""
    },
    {
      "day": "Utorok",
      "date": "2026-09-08",
      "time": "09:00",
      "intention": "Na vlastný úmysel",
      "place": "",
      "note": "Narodenie Preblahoslavenej Panny Márie"
    },
    {
      "day": "Streda",
      "date": "2026-09-09",
      "time": "17:00",
      "intention": "Za zdravie a Božie požehnanie pre rodinu Róthovú",
      "place": "",
      "note": "Najsvätejšieho mena Panny Márie"
    },
    {
      "day": "Štvrtok",
      "date": "2026-09-10",
      "time": "17:00",
      "intention": "Za zdravie a Božie požehnanie pre rodinu Škrváňovú",
      "place": "",
      "note": ""
    },
    {
      "day": "Piatok",
      "date": "2026-09-11",
      "time": "17:00",
      "intention": "Za veriacich",
      "place": "",
      "note": ""
    },
    {
      "day": "Sobota",
      "date": "2026-09-12",
      "time": "08:00",
      "intention": " Za + rodinu Pančilovú",
      "place": "",
      "note": ""
    },
    {
      "day": "Nedeľa",
      "date": "2026-09-13",
      "time": "09:00",
      "intention": "Za + rodičov Margitu a Štefana brata Martina a tetu Ľudmilu",
      "place": "",
      "note": "24. nedeľa cez rok"
    }
  ]
}
