{
  "title": "27. nedeľa cez rok ",
  "weekNumber": 41,
  "year": 2026,
  "weekStart": "2026-10-05",
  "weekEnd": "2026-10-11",
  "general": "Tento týždeň upratuje skupina číslo 3",
  "masses": [
    {
      "day": "Pondelok",
      "date": "2026-10-05",
      "time": "00:00",
      "intention": "OMŠA NEBUDE ",
      "place": "",
      "note": ""
    },
    {
      "day": "Utorok",
      "date": "2026-10-06",
      "time": "09:00",
      "intention": "Za Kristínu a Vladimíra na úmysel",
      "place": "",
      "note": ""
    },
    {
      "day": "Streda",
      "date": "2026-10-07",
      "time": "17:00",
      "intention": "Za + Natašu",
      "place": "",
      "note": "Ružencovej Panny Márie"
    },
    {
      "day": "Štvrtok",
      "date": "2026-10-08",
      "time": "17:00",
      "intention": "Za + manžela Jána",
      "place": "",
      "note": ""
    },
    {
      "day": "Piatok",
      "date": "2026-10-09",
      "time": "17:00",
      "intention": "Za veriacich",
      "place": "",
      "note": ""
    },
    {
      "day": "Sobota",
      "date": "2026-10-10",
      "time": "08:00",
      "intention": "Za + Oľgu Škrváňovú 2.výr.a jej sestru Vieru",
      "place": "",
      "note": ""
    },
    {
      "day": "Nedeľa",
      "date": "2026-10-11",
      "time": "09:00",
      "intention": "Za Božiu pomoc a zdravie pre synov Jozefa a Ladislava",
      "place": "",
      "note": "28. nedeľa cez rok "
    }
  ]
}
