{
  "title": "Farské oznamy – 22. týždeň 2026",
  "weekNumber": 22,
  "year": 2026,
  "weekStart": "2026-05-25",
  "weekEnd": "2026-05-31",
  "general": "Nejaký oznam\n\nUpratuje skupina číslo 3",
  "masses": [
    {
      "day": "Pondelok",
      "date": "2026-05-25",
      "time": "17:00",
      "intention": "Za CMS",
      "place": "",
      "note": ""
    },
    {
      "day": "Utorok",
      "date": "2026-05-26",
      "time": "09:00",
      "intention": "Za WEB stránku a jej vzhľad",
      "place": "",
      "note": ""
    },
    {
      "day": "Streda",
      "date": "2026-05-27",
      "time": "17:00",
      "intention": "",
      "place": "",
      "note": ""
    },
    {
      "day": "Štvrtok",
      "date": "2026-05-28",
      "time": "17:00",
      "intention": "",
      "place": "",
      "note": ""
    },
    {
      "day": "Piatok",
      "date": "2026-05-29",
      "time": "17:00",
      "intention": "",
      "place": "",
      "note": ""
    },
    {
      "day": "Sobota",
      "date": "2026-05-30",
      "time": "08:00",
      "intention": "",
      "place": "",
      "note": ""
    },
    {
      "day": "Nedeľa",
      "date": "2026-05-31",
      "time": "09:00",
      "intention": "",
      "place": "",
      "note": ""
    }
  ]
}
